"id","category","file","max_seconds","en","ar","notes"
"upes-ecs/drill-prompt","system","upes-ecs/drill-prompt.wav","11","This is a UPES emergency system drill. This is only a test. No real emergency is in progress, and no response will be dispatched. Thank you.","هذا تدريب لنظام الطوارئ في UPES. هذا مجرد اختبار. لا توجد حالة طوارئ حقيقية جارية، ولن يتم إرسال أي استجابة. شكرًا.","System status prompt: neutral, clear, brief."
"upes-ecs/emergency-voicemail-prompt","system","upes-ecs/emergency-voicemail-prompt.wav","14","No responder is available to take your call right now. After the tone, please say your name, where you are, and what is happening. Stay safe. Help will call you back as soon as possible.","لا يوجد مستجيب متاح لتلقي مكالمتك الآن. بعد النغمة، من فضلك قل اسمك، وأين أنت، وما الذي يحدث. ابقَ آمنًا. سيعاود فريق المساعدة الاتصال بك في أقرب وقت ممكن.","System status prompt: neutral, clear, brief."
"upes-ecs/not-authorized","system","upes-ecs/not-authorized.wav","4","Sorry. You are not authorised to use this feature.","عذرًا. أنت غير مخوّل لاستخدام هذه الميزة.","System status prompt: neutral, clear, brief. Very short prompt: keep spoken length under about 4s."
"upes-ecs/queue-hold","system","upes-ecs/queue-hold.wav","6","Please stay on the line. We are connecting you to a responder now.","من فضلك ابقَ على الخط. نحن نوصلك بمستجيب الآن.","System status prompt: neutral, clear, brief. Very short prompt: keep spoken length under about 6s."
"upes-ecs/queue-paused","system","upes-ecs/queue-paused.wav","7","You are now paused, and will not receive emergency calls. Dial star four six to resume.","أنت الآن متوقف مؤقتًا، ولن تتلقى مكالمات الطوارئ. اطلب نجمة أربعة ستة للاستئناف.","System status prompt: neutral, clear, brief. Contains a star / feature code (e.g. *23, *46): keep the digits exactly. Render ""star"" plus the digits the way your users dial them - see the guide. Very short prompt: keep spoken length under about 7s."
"upes-ecs/queue-resumed","system","upes-ecs/queue-resumed.wav","4","You are now available, and will receive emergency calls again.","أنت الآن متاح، وستتلقى مكالمات الطوارئ مرة أخرى.","System status prompt: neutral, clear, brief. Very short prompt: keep spoken length under about 4s."
"upes-ecs/coach/pick-language","coach","upes-ecs/coach/pick-language.wav","8","To change the language, press 1 for English, or 2 for Hindi.","لتغيير اللغة، اضغط 1 للإنجليزية، أو 2 للهندية.","Language chooser played on * in the panic-coach. Keys 1 and 2 are physical DTMF - keep the numerals; translate the language names naturally. Draft (AI) - native review pending."
