"id","category","file","max_seconds","en","hi","notes"
"custom/upes-rollcall","eas","custom/upes-rollcall.wav","10","Attention. This is the UPES Emergency Alert Service. This is a safety head count. If you are safe and able to respond, press one now.","ध्यान दें। यह यूपीईएस आपातकालीन चेतावनी सेवा है। यह एक सुरक्षा गणना है। यदि आप सुरक्षित हैं और उत्तर देने में सक्षम हैं, तो अभी एक दबाएँ।","Mass emergency alert announcement: authoritative and clear, never panicked. PRESS-A-KEY prompt. Keep the phone key(s) EXACTLY: 1. The caller physically presses that key on the phone, so translate the word ""press"" but NEVER change or translate the number itself. Keep ""UPES Emergency Alert Service"" as the recognisable service name - see the guide for how to render the brand + acronym."
"custom/upes-test","eas","custom/upes-test.wav","11","This is a test of the UPES Emergency Alert Service. This is only a test. No action is required, and no emergency response will be dispatched.","यह यूपीईएस आपातकालीन चेतावनी सेवा का एक परीक्षण है। यह केवल एक परीक्षण है। किसी कार्रवाई की आवश्यकता नहीं है, और कोई आपातकालीन प्रतिक्रिया नहीं भेजी जाएगी।","Mass emergency alert announcement: authoritative and clear, never panicked. Keep ""UPES Emergency Alert Service"" as the recognisable service name - see the guide for how to render the brand + acronym."
"upes-ecs/rollcall-press1","rollcall","upes-ecs/rollcall-press1.wav","4","Press one if you are safe.","यदि आप सुरक्षित हैं, तो एक दबाएँ।","Head-count / roll-call prompt: short and unambiguous. PRESS-A-KEY prompt. Keep the phone key(s) EXACTLY: 1. The caller physically presses that key on the phone, so translate the word ""press"" but NEVER change or translate the number itself. Very short prompt: keep spoken length under about 4s."
"upes-ecs/rollcall-thanks","rollcall","upes-ecs/rollcall-thanks.wav","5","Thank you. You are marked safe. You may now hang up.","धन्यवाद। आपको सुरक्षित दर्ज कर लिया गया है। अब आप कॉल समाप्त कर सकते हैं।","Head-count / roll-call prompt: short and unambiguous. Very short prompt: keep spoken length under about 5s."
"upes-ecs/rollcall-noack","rollcall","upes-ecs/rollcall-noack.wav","6","No response was recorded. Please contact your warden as soon as you are able.","कोई उत्तर दर्ज नहीं हुआ। कृपया जितनी जल्दी संभव हो अपने वार्डन से संपर्क करें।","Head-count / roll-call prompt: short and unambiguous. Very short prompt: keep spoken length under about 6s."
"upes-ecs/announce-evacuate","paging","upes-ecs/announce-evacuate.wav","14","Attention. This is the UPES Emergency Alert Service. Evacuate the building now. Leave immediately by the nearest safe exit. Do not use the lifts. Move to your assembly point and await further instructions.","ध्यान दें। यह यूपीईएस आपातकालीन चेतावनी सेवा है। अभी इमारत ख़ाली करें। नज़दीकी सुरक्षित निकास से तुरंत बाहर निकलें। लिफ़्ट का उपयोग न करें। अपने एकत्रीकरण स्थल पर जाएँ और आगे के निर्देशों की प्रतीक्षा करें।","Campus-wide paging announcement: authoritative and clear (same wording family as the alerts). Keep ""UPES Emergency Alert Service"" as the recognisable service name - see the guide for how to render the brand + acronym."
"upes-ecs/announce-avoid-area","paging","upes-ecs/announce-avoid-area.wav","14","Attention. This is the UPES Emergency Alert Service. There is an incident on campus. Stay away from the affected area, do not approach, and follow the instructions of security staff. Await further instructions.","ध्यान दें। यह यूपीईएस आपातकालीन चेतावनी सेवा है। कैंपस में एक घटना हुई है। प्रभावित क्षेत्र से दूर रहें, पास न जाएँ, और सुरक्षा कर्मियों के निर्देशों का पालन करें। आगे के निर्देशों की प्रतीक्षा करें।","Campus-wide paging announcement: authoritative and clear (same wording family as the alerts). Keep ""UPES Emergency Alert Service"" as the recognisable service name - see the guide for how to render the brand + acronym."
"upes-ecs/announce-all-clear","paging","upes-ecs/announce-all-clear.wav","10","Attention. This is the UPES Emergency Alert Service. The emergency is now over. It is safe to resume normal activity. Thank you for your cooperation.","ध्यान दें। यह यूपीईएस आपातकालीन चेतावनी सेवा है। आपात स्थिति अब समाप्त हो गई है। सामान्य गतिविधि फिर से शुरू करना सुरक्षित है। आपके सहयोग के लिए धन्यवाद।","Campus-wide paging announcement: authoritative and clear (same wording family as the alerts). Keep ""UPES Emergency Alert Service"" as the recognisable service name - see the guide for how to render the brand + acronym."
"upes-ecs/announce-assemble","paging","upes-ecs/announce-assemble.wav","12","Attention. This is the UPES Emergency Alert Service. Proceed to your designated assembly point now. Move calmly, help others where you can, and wait to be counted. Await further instructions.","ध्यान दें। यह यूपीईएस आपातकालीन चेतावनी सेवा है। अभी अपने निर्धारित एकत्रीकरण स्थल पर जाएँ। शांति से चलें, जहाँ संभव हो दूसरों की मदद करें, और गिनती के लिए प्रतीक्षा करें। आगे के निर्देशों की प्रतीक्षा करें।","Campus-wide paging announcement: authoritative and clear (same wording family as the alerts). Keep ""UPES Emergency Alert Service"" as the recognisable service name - see the guide for how to render the brand + acronym."
"upes-ecs/callout-notify","paging","upes-ecs/callout-notify.wav","8","Attention. This is a notification from the UPES Emergency Alert Service. Please listen carefully and follow the instructions that follow.","ध्यान दें। यह यूपीईएस आपातकालीन चेतावनी सेवा की ओर से एक सूचना है। कृपया ध्यान से सुनें और आगे दिए गए निर्देशों का पालन करें।","Campus-wide paging announcement: authoritative and clear (same wording family as the alerts). Keep ""UPES Emergency Alert Service"" as the recognisable service name - see the guide for how to render the brand + acronym. Very short prompt: keep spoken length under about 8s."
"upes-ecs/drill-prompt","system","upes-ecs/drill-prompt.wav","11","This is a UPES emergency system drill. This is only a test. No real emergency is in progress, and no response will be dispatched. Thank you.","यह यूपीईएस आपातकालीन प्रणाली का एक अभ्यास है। यह केवल एक परीक्षण है। कोई वास्तविक आपात स्थिति नहीं है, और कोई प्रतिक्रिया नहीं भेजी जाएगी। धन्यवाद।","System status prompt: neutral, clear, brief."
"upes-ecs/emergency-voicemail-prompt","system","upes-ecs/emergency-voicemail-prompt.wav","14","No responder is available to take your call right now. After the tone, please say your name, where you are, and what is happening. Stay safe. Help will call you back as soon as possible.","अभी आपकी कॉल लेने के लिए कोई रिस्पॉन्डर उपलब्ध नहीं है। टोन के बाद, कृपया अपना नाम, आप कहाँ हैं, और क्या हो रहा है यह बताएँ। सुरक्षित रहें। मदद जल्द से जल्द आपको वापस कॉल करेगी।","System status prompt: neutral, clear, brief."
"upes-ecs/not-authorized","system","upes-ecs/not-authorized.wav","4","Sorry. You are not authorised to use this feature.","क्षमा करें। आप इस सुविधा का उपयोग करने के लिए अधिकृत नहीं हैं।","System status prompt: neutral, clear, brief. Very short prompt: keep spoken length under about 4s."
"upes-ecs/queue-hold","system","upes-ecs/queue-hold.wav","6","Please stay on the line. We are connecting you to a responder now.","कृपया लाइन पर बने रहें। हम आपको अभी एक रिस्पॉन्डर से जोड़ रहे हैं।","System status prompt: neutral, clear, brief. Very short prompt: keep spoken length under about 6s."
"upes-ecs/queue-paused","system","upes-ecs/queue-paused.wav","7","You are now paused, and will not receive emergency calls. Dial star four six to resume.","अब आप रोक दिए गए हैं, और आपको आपातकालीन कॉलें नहीं मिलेंगी। फिर से शुरू करने के लिए स्टार चार छह डायल करें।","System status prompt: neutral, clear, brief. Contains a star / feature code (e.g. *23, *46): keep the digits exactly. Render ""star"" plus the digits the way your users dial them - see the guide. Very short prompt: keep spoken length under about 7s."
"upes-ecs/queue-resumed","system","upes-ecs/queue-resumed.wav","4","You are now available, and will receive emergency calls again.","अब आप उपलब्ध हैं, और आपको फिर से आपातकालीन कॉलें मिलेंगी।","System status prompt: neutral, clear, brief. Very short prompt: keep spoken length under about 4s."
"upes-ecs/coach/pick-language","coach","upes-ecs/coach/pick-language.wav","8","To change the language, press 1 for English, or 2 for Hindi.","भाषा बदलने के लिए, अंग्रेज़ी के लिए एक दबाएँ, या हिंदी के लिए दो दबाएँ।","PRESS-A-KEY prompt. Keep the phone keys EXACTLY: 1, 2. Translate the word press and the language names, but never the key digit itself. Tone: calm, clear."
