"id","category","file","max_seconds","en","ku","notes"
"upes-ecs/coach/intro","coach","upes-ecs/coach/intro.wav","20","You have reached the campus emergency guidance line. No responder is free at this moment, and help has been alerted to call you back. Stay calm. Take a slow breath. I will guide you through what to do. If you are able, also call your national emergency number now.","Hûn gihîştin xeta rêberiya awarte ya kampusê. Di vê kêliyê de tu bersivder ne vala ye, û ji bo ku telefonê li we vegerîne alîkarî hat agahdarkirin. Aram bimînin. Hêdî hênaseyekê bistînin. Ez ê rê nîşanî we bidim ka çi bikin. Heke hûn dikarin, niha jî li jimareya awarte ya neteweyî ya xwe telefon bikin.","First-aid / crisis coaching: keep every step AND its order exactly. Do not add, drop, or reorder instructions - accuracy is safety-critical. Tone: calm, clear, unhurried."
"upes-ecs/coach/intro-test","coach","upes-ecs/coach/intro-test.wav","11","This is the campus emergency guidance line, in test mode. No real incident is being logged. I will guide you through what to do in an emergency.","Ev xeta rêberiya awarte ya kampusê ye, di moda testê de. Tu bûyera rastîn nayê tomarkirin. Ez ê rê nîşanî we bidim ka di rewşeke awarte de çi bikin.","First-aid / crisis coaching: keep every step AND its order exactly. Do not add, drop, or reorder instructions - accuracy is safety-critical. Tone: calm, clear, unhurried."
"upes-ecs/coach/menu","coach","upes-ecs/coach/menu.wav","29","Choose the situation. Press 1 if someone is not breathing or has no pulse. Press 2 for severe bleeding. Press 3 for choking. Press 4 for fire or smoke. Press 5 for a threat, attacker, or lockdown. Press 6 if someone is unconscious but breathing. Press 7 if you are trapped. Press 9 to try a responder again. Press 8 to leave a message. Press 0 to hear these choices again.","Rewşê hilbijêrin. Heke kesek hênase nagire an nabize, pêl yekê bikin. Ji bo xwînrijandina giran, pêl duyê bikin. Ji bo fetisandinê, pêl sêyê bikin. Ji bo agir an dû, pêl çarê bikin. Ji bo metirsî, êrişkar, an girtinê, pêl pêncê bikin. Heke kesek bêhiş e lê hênase digire, pêl şeşê bikin. Heke hûn asê mane, pêl heftê bikin. Ji bo dîsa ceribandina bersivderekê, pêl nehê bikin. Ji bo hiştina peyamekê, pêl heştê bikin. Ji bo dîsa bihîstina van hilbijartinan, pêl sifirê bikin.","First-aid / crisis coaching: keep every step AND its order exactly. Do not add, drop, or reorder instructions - accuracy is safety-critical. Tone: calm, clear, unhurried. PRESS-A-KEY prompt. Keep the phone key(s) EXACTLY: 1, 2, 3, 4, 5, 6, 7, 9, 8, 0. The caller physically presses that key on the phone, so translate the word ""press"" but NEVER change or translate the number itself."
"upes-ecs/coach/cpr","coach","upes-ecs/coach/cpr.wav","33","Put the person on their back on a firm surface and kneel beside them. Place the heel of one hand in the centre of the chest, and your other hand on top. Push down hard and fast, about twice every second, letting the chest rise fully each time. Keep going without stopping. If someone is nearby, send them for the nearest defibrillator, and turn it on to follow its spoken instructions. Do not stop until help arrives or the person wakes.","Kesî li ser piştê deynin ser rûyekî hişk û li kêleka wî çok bidin. Bereka destekî xwe deynin ser navenda sîngê, û destê xwe yê din deynin ser wî. Bi hêz û bilez pêve bikin, nêzîkî du caran di her çirkeyê de, û bihêlin sîng her carê bi temamî rabe. Bêyî rawestanê berdewam bikin. Heke kesek nêzîk be, wî bişînin ku nêztirîn defibrilatorê bîne, û wî vekin da ku talîmatên wî yên devkî bişopînin. Heta alîkarî neyê an kes hişyar nebe, ranewestin.","First-aid / crisis coaching: keep every step AND its order exactly. Do not add, drop, or reorder instructions - accuracy is safety-critical. Tone: calm, clear, unhurried. ""defibrillator"" (AED): use the locally understood term for the automatic shock device."
"upes-ecs/coach/bleeding","coach","upes-ecs/coach/bleeding.wav","29","Press firmly and directly on the wound with a cloth or your hand. Do not remove the cloth. If blood soaks through, add more on top and keep pressing hard. If it is an arm or a leg and the bleeding will not stop, tie a strong band tightly a few centimetres above the wound, between the wound and the heart, and note the time. Keep the person warm and still.","Bi parçeyek qumaş an bi destê xwe, rasterast û bi hêz li ser birînê pêve bikin. Qumaş ranekin. Heke xwîn tê re derbas dibe, li jor hê zêdetir lê zêde bikin û bi hêz pêve bikin. Heke ew mil an ling e û xwîn nayê rawestandin, çend santîmetreyan li jorê birînê, di navbera birîn û dil de, bendeke bihêz teng girê bidin, û demê tomar bikin. Kesî germ û bêhereket bihêlin.","First-aid / crisis coaching: keep every step AND its order exactly. Do not add, drop, or reorder instructions - accuracy is safety-critical. Tone: calm, clear, unhurried."
"upes-ecs/coach/choking","coach","upes-ecs/coach/choking.wav","28","Ask if they can speak or cough. If they cannot breathe, stand behind them and give five firm blows between the shoulder blades with the heel of your hand. If that does not work, wrap your arms around their waist and give five quick inward and upward thrusts just above the navel. Keep repeating the back blows and the thrusts until the object comes out or help arrives.","Ji wan bipirsin ka dikarin biaxivin an bikuxin. Heke nikarin hênase bigirin, li pişt wan rawestin û bi bereka destê xwe pênc lêdanên bihêz di navbera her du milan de li piştê bidin. Heke ev bi kêr neyê, milên xwe li dora nava wan bipêçin û tenê li jorê navikê pênc caran bi lez ber bi hundir û jor ve bitepisînin. Heta ku tişt derkeve an alîkarî bigihîje, lêdanên piştê û tepisandinan dubare bikin.","First-aid / crisis coaching: keep every step AND its order exactly. Do not add, drop, or reorder instructions - accuracy is safety-critical. Tone: calm, clear, unhurried."
"upes-ecs/coach/fire","coach","upes-ecs/coach/fire.wav","25","Get everyone out now, and do not stop for belongings. Stay low under the smoke, where the air is clearer. Before opening any door, feel it with the back of your hand. If it is hot, find another way out. Do not use the lifts. Once you are outside, stay outside, and move to the assembly point. Do not go back in.","Niha herkesî derxînin, û ji bo tiştên xwe ranewestin. Li bin dûyê nizm bimînin, li cihê ku hewa paqijtir e. Berî ku hûn deriyekî vekin, bi paşila destê xwe wî hîs bikin. Heke germ be, rêyeke din a derketinê bibînin. Asansoran bikar neînin. Gava hûn derketin derve, li derve bimînin, û ber bi cihê civînê ve biçin. Venegerin hundir.","First-aid / crisis coaching: keep every step AND its order exactly. Do not add, drop, or reorder instructions - accuracy is safety-critical. Tone: calm, clear, unhurried."
"upes-ecs/coach/lockdown","coach","upes-ecs/coach/lockdown.wav","27","If you can leave the area safely, move away from the danger quietly and quickly. If you cannot, get into a room, lock or block the door, and stay low, away from windows and doors. Turn off the lights and set your phone to silent. Stay quiet and out of sight. Do not open the door until security or the police tell you it is safe.","Heke hûn dikarin bi ewlehî ji herêmê derkevin, bêdeng û bilez ji metirsiyê dûr bikevin. Heke nikarin, biçin nav odeyekê, deriyê bigirin an asteng bikin, û nizm bimînin, dûrî pencere û deriyan. Ronahiyan vemirînin û telefona xwe deynin ser bêdeng. Bêdeng û ji ber çavan winda bimînin. Heta ku ewlehî an polîs nebêjin ku ewle ye, deriyê venekin.","First-aid / crisis coaching: keep every step AND its order exactly. Do not add, drop, or reorder instructions - accuracy is safety-critical. Tone: calm, clear, unhurried."
"upes-ecs/coach/recovery","coach","upes-ecs/coach/recovery.wav","22","If the person is breathing but not awake, gently roll them onto their side. Tilt their head back a little to keep the airway open, and lift their chin. Stay with them and keep watching that they are still breathing. If they stop breathing, begin chest compressions in the centre of the chest.","Heke kes hênase digire lê hişyar nîne, wî hêdî hêdî li ser aliyê wî bizivirînin. Serê wî hinekî ber bi paş ve xwar bikin da ku rêya hewayê vekirî bimîne, û çenê wî rakin. Digel wî bimînin û temaşe bikin ku ew hê hênase digire. Heke ew hênase rawestîne, li navenda sîngê tepisandina sîngê dest pê bikin.","First-aid / crisis coaching: keep every step AND its order exactly. Do not add, drop, or reorder instructions - accuracy is safety-critical. Tone: calm, clear, unhurried."
"upes-ecs/coach/trapped","coach","upes-ecs/coach/trapped.wav","26","Stay as calm and still as you can, to save air and energy. Cover your nose and mouth with cloth against dust. Tap steadily on a pipe, a wall, or any hard surface, so rescuers can hear you. Shout only as a last resort, to avoid breathing in dust. Do not light any flame. Move as little as possible and wait to be found.","Ji bo ku hewa û enerjiyê biparêzin, bi qasî ku hûn dikarin aram û bêhereket bimînin. Poz û devê xwe bi qumaş li dijî tozê bigirin. Bi domdarî li ser boriyekê, dîwarekî, an her rûyekî hişk bixin, da ku rizgarkar bikaribin we bibihîzin. Tenê wek çareya dawî biqîrin, da ku toz nekeve hundir. Tu agir venexînin. Bi qasî ku dibe kêm bilivin û li bendê bimînin ku werin dîtin.","First-aid / crisis coaching: keep every step AND its order exactly. Do not add, drop, or reorder instructions - accuracy is safety-critical. Tone: calm, clear, unhurried."
"upes-ecs/coach/tryagain","coach","upes-ecs/coach/tryagain.wav","6","I am trying to reach a responder now. Please stay on the line and hold.","Ez niha hewl didim ku bigihîjim bersivderekê. Ji kerema xwe li ser xetê bimînin û li bendê bin.","First-aid / crisis coaching: keep every step AND its order exactly. Do not add, drop, or reorder instructions - accuracy is safety-critical. Tone: calm, clear, unhurried. Very short prompt: keep spoken length under about 6s."
"upes-ecs/coach/noresponder","coach","upes-ecs/coach/noresponder.wav","6","No responder is free yet. I will stay with you. Returning to the guidance.","Hê tu bersivder ne vala ye. Ez ê digel we bimînim. Vedigerim rêberiyê.","First-aid / crisis coaching: keep every step AND its order exactly. Do not add, drop, or reorder instructions - accuracy is safety-critical. Tone: calm, clear, unhurried. Very short prompt: keep spoken length under about 6s."
"upes-ecs/coach/invalid","coach","upes-ecs/coach/invalid.wav","4","Sorry, I did not understand that.","Bibore, min ew fêm nekir.","First-aid / crisis coaching: keep every step AND its order exactly. Do not add, drop, or reorder instructions - accuracy is safety-critical. Tone: calm, clear, unhurried. Very short prompt: keep spoken length under about 4s."
"upes-ecs/coach/nochoice","coach","upes-ecs/coach/nochoice.wav","4","I did not hear a choice.","Min tu hilbijartin nebihîst.","First-aid / crisis coaching: keep every step AND its order exactly. Do not add, drop, or reorder instructions - accuracy is safety-critical. Tone: calm, clear, unhurried. Very short prompt: keep spoken length under about 4s."
"upes-ecs/coach/leavemsg","coach","upes-ecs/coach/leavemsg.wav","10","I will now let you leave a message for the response team. After the tone, say where you are and what is happening.","Ez ê niha bihêlim ku hûn ji tîma bersivê re peyamekê bihêlin. Piştî dengî, bibêjin hûn li ku ne û çi diqewime.","First-aid / crisis coaching: keep every step AND its order exactly. Do not add, drop, or reorder instructions - accuracy is safety-critical. Tone: calm, clear, unhurried."
"upes-ecs/coach/fastpath-intro","coach","upes-ecs/coach/fastpath-intro.wav","8","First aid guidance. A responder is still being alerted and will join if they can. Stay with me.","Rêberiya alîkariya pêşîn. Hê bersivderek tê agahdarkirin û heke bikaribe wê beşdar bibe. Digel min bimînin.","First-aid / crisis coaching: keep every step AND its order exactly. Do not add, drop, or reorder instructions - accuracy is safety-critical. Tone: calm, clear, unhurried. Very short prompt: keep spoken length under about 8s."
"upes-ecs/emergency-preanswer","flow","upes-ecs/emergency-preanswer.wav","16","You have reached the campus emergency line. Your call is being recorded, and help is being reached now. Stay on the line. If someone needs first aid right now, press 1 at any time, and I will guide you.","Hûn gihîştin xeta awarte ya kampusê. Bangê we tê tomarkirin, û niha alîkarî tê gihandin. Li ser xetê bimînin. Heke kesek niha alîkariya pêşîn hewce dike, her dem pêl yekê bikin, û ez ê rê nîşanî we bidim.","Emergency call-flow line: calm, reassuring authority. Keep it short. PRESS-A-KEY prompt. Keep the phone key(s) EXACTLY: 1. The caller physically presses that key on the phone, so translate the word ""press"" but NEVER change or translate the number itself."
"upes-ecs/hold-firstaid","flow","upes-ecs/hold-firstaid.wav","8","Still connecting you to a responder. If you need first aid now, press 1 for step by step guidance.","Hê jî hûn bi bersivderekê ve tên girêdan. Heke hûn niha alîkariya pêşîn hewce dikin, ji bo rêberiya gav bi gav pêl yekê bikin.","Emergency call-flow line: calm, reassuring authority. Keep it short. PRESS-A-KEY prompt. Keep the phone key(s) EXACTLY: 1. The caller physically presses that key on the phone, so translate the word ""press"" but NEVER change or translate the number itself. Very short prompt: keep spoken length under about 8s."
"upes-ecs/responder-alert","flow","upes-ecs/responder-alert.wav","12","Emergency alert. There is an active call on the campus emergency line and no responder has answered. Please make yourself available now. Press 1 to join the emergency queue.","Hişyariya awarte. Li ser xeta awarte ya kampusê bangeke çalak heye û tu bersivderî bersiv neda. Ji kerema xwe niha xwe amade bikin. Ji bo tevlîbûna rêza awarte pêl yekê bikin.","Emergency call-flow line: calm, reassuring authority. Keep it short. PRESS-A-KEY prompt. Keep the phone key(s) EXACTLY: 1. The caller physically presses that key on the phone, so translate the word ""press"" but NEVER change or translate the number itself."
"upes-ecs/shift-on","flow","upes-ecs/shift-on.wav","9","You are now on shift. You will receive campus emergency calls until you go off shift by dialling star two three.","Hûn niha di dewrê de ne. Hûn ê bangên awarte yên kampusê wergirin heta ku hûn bi kêşana stêrk du sê ji dewrê dernekevin.","Emergency call-flow line: calm, reassuring authority. Keep it short. Contains a star / feature code (e.g. *23, *46): keep the digits exactly. Render ""star"" plus the digits the way your users dial them - see the guide."
"upes-ecs/shift-off","flow","upes-ecs/shift-off.wav","6","You are now off shift. You will no longer receive campus emergency calls.","Hûn niha ji dewrê derketin. Hûn ê êdî bangên awarte yên kampusê wernegirin.","Emergency call-flow line: calm, reassuring authority. Keep it short. Very short prompt: keep spoken length under about 6s."
"custom/upes-evacuate","eas","custom/upes-evacuate.wav","14","Attention. This is the UPES Emergency Alert Service. Evacuate the building now. Leave immediately by the nearest safe exit. Do not use the lifts. Move to your assembly point and await further instructions.","Bala xwe bidin. Ev Xizmeta Hişyariya Awarte ya UPES e. Niha avahiyê vala bikin. Bi lez ji deriyê derketina ewle ya nêztirîn derkevin. Asansoran bikar neînin. Ber bi cihê civîna xwe ve biçin û li benda talîmatên din bin.","Mass emergency alert announcement: authoritative and clear, never panicked. Keep ""UPES Emergency Alert Service"" as the recognisable service name - see the guide for how to render the brand + acronym."
"custom/upes-shelter","eas","custom/upes-shelter.wav","15","Attention. This is the UPES Emergency Alert Service. Shelter in place now. Move indoors, lock or block your door, stay away from windows, and remain quiet until you are told it is safe. Await further instructions.","Bala xwe bidin. Ev Xizmeta Hişyariya Awarte ya UPES e. Niha li cihê xwe bimînin û xwe biparêzin. Biçin hundir, deriyê xwe bigirin an asteng bikin, dûrî pencereyan bimînin, û heta ku ji we re neyê gotin ku ewle ye bêdeng bimînin. Li benda talîmatên din bin.","Mass emergency alert announcement: authoritative and clear, never panicked. Keep ""UPES Emergency Alert Service"" as the recognisable service name - see the guide for how to render the brand + acronym."
"custom/upes-allclear","eas","custom/upes-allclear.wav","10","Attention. This is the UPES Emergency Alert Service. The emergency is now over. It is safe to resume normal activity. Thank you for your cooperation.","Bala xwe bidin. Ev Xizmeta Hişyariya Awarte ya UPES e. Rewşa awarte niha qediya. Ewle ye ku hûn vegerin ser çalakiya asayî. Ji bo hevkariya we spas dikin.","Mass emergency alert announcement: authoritative and clear, never panicked. Keep ""UPES Emergency Alert Service"" as the recognisable service name - see the guide for how to render the brand + acronym."
"custom/upes-assemble","eas","custom/upes-assemble.wav","12","Attention. This is the UPES Emergency Alert Service. Proceed to your designated assembly point now. Move calmly, help others where you can, and wait to be counted. Await further instructions.","Bala xwe bidin. Ev Xizmeta Hişyariya Awarte ya UPES e. Niha biçin cihê civîna xwe yê diyarkirî. Bi aramî bimeşin, li cihê ku hûn dikarin alîkariya kesên din bikin, û li benda jimartinê bin. Li benda talîmatên din bin.","Mass emergency alert announcement: authoritative and clear, never panicked. Keep ""UPES Emergency Alert Service"" as the recognisable service name - see the guide for how to render the brand + acronym."
"custom/upes-rollcall","eas","custom/upes-rollcall.wav","10","Attention. This is the UPES Emergency Alert Service. This is a safety head count. If you are safe and able to respond, press one now.","Bala xwe bidin. Ev Xizmeta Hişyariya Awarte ya UPES e. Ev jimartina ewlehiyê ye. Heke hûn ewle ne û dikarin bersiv bidin, niha pêl yekê bikin.","Mass emergency alert announcement: authoritative and clear, never panicked. PRESS-A-KEY prompt. Keep the phone key(s) EXACTLY: 1. The caller physically presses that key on the phone, so translate the word ""press"" but NEVER change or translate the number itself. Keep ""UPES Emergency Alert Service"" as the recognisable service name - see the guide for how to render the brand + acronym."
"custom/upes-test","eas","custom/upes-test.wav","11","This is a test of the UPES Emergency Alert Service. This is only a test. No action is required, and no emergency response will be dispatched.","Ev testeke Xizmeta Hişyariya Awarte ya UPES e. Ev tenê testek e. Tu tevger ne hewce ye, û tu bersiva awarte nayê şandin.","Mass emergency alert announcement: authoritative and clear, never panicked. Keep ""UPES Emergency Alert Service"" as the recognisable service name - see the guide for how to render the brand + acronym."
"upes-ecs/rollcall-press1","rollcall","upes-ecs/rollcall-press1.wav","4","Press one if you are safe.","Heke hûn ewle ne, pêl yekê bikin.","Head-count / roll-call prompt: short and unambiguous. PRESS-A-KEY prompt. Keep the phone key(s) EXACTLY: 1. The caller physically presses that key on the phone, so translate the word ""press"" but NEVER change or translate the number itself. Very short prompt: keep spoken length under about 4s."
"upes-ecs/rollcall-thanks","rollcall","upes-ecs/rollcall-thanks.wav","5","Thank you. You are marked safe. You may now hang up.","Spas. Hûn wek ewle hatin nîşankirin. Hûn niha dikarin telefonê daynin.","Head-count / roll-call prompt: short and unambiguous. Very short prompt: keep spoken length under about 5s."
"upes-ecs/rollcall-noack","rollcall","upes-ecs/rollcall-noack.wav","6","No response was recorded. Please contact your warden as soon as you are able.","Tu bersiv nehat tomarkirin. Ji kerema xwe bi qasî ku hûn dikarin zû bi wardenê xwe re têkilî daynin.","Head-count / roll-call prompt: short and unambiguous. Very short prompt: keep spoken length under about 6s."
"upes-ecs/announce-evacuate","paging","upes-ecs/announce-evacuate.wav","14","Attention. This is the UPES Emergency Alert Service. Evacuate the building now. Leave immediately by the nearest safe exit. Do not use the lifts. Move to your assembly point and await further instructions.","Bala xwe bidin. Ev Xizmeta Hişyariya Awarte ya UPES e. Niha avahiyê vala bikin. Bi lez ji deriyê derketina ewle ya nêztirîn derkevin. Asansoran bikar neînin. Ber bi cihê civîna xwe ve biçin û li benda talîmatên din bin.","Campus-wide paging announcement: authoritative and clear (same wording family as the alerts). Keep ""UPES Emergency Alert Service"" as the recognisable service name - see the guide for how to render the brand + acronym."
"upes-ecs/announce-avoid-area","paging","upes-ecs/announce-avoid-area.wav","14","Attention. This is the UPES Emergency Alert Service. There is an incident on campus. Stay away from the affected area, do not approach, and follow the instructions of security staff. Await further instructions.","Bala xwe bidin. Ev Xizmeta Hişyariya Awarte ya UPES e. Li kampusê bûyerek heye. Ji herêma bandorbûyî dûr bimînin, nêzîk nebin, û talîmatên personelên ewlehiyê bişopînin. Li benda talîmatên din bin.","Campus-wide paging announcement: authoritative and clear (same wording family as the alerts). Keep ""UPES Emergency Alert Service"" as the recognisable service name - see the guide for how to render the brand + acronym."
"upes-ecs/announce-all-clear","paging","upes-ecs/announce-all-clear.wav","10","Attention. This is the UPES Emergency Alert Service. The emergency is now over. It is safe to resume normal activity. Thank you for your cooperation.","Bala xwe bidin. Ev Xizmeta Hişyariya Awarte ya UPES e. Rewşa awarte niha qediya. Ewle ye ku hûn vegerin ser çalakiya asayî. Ji bo hevkariya we spas dikin.","Campus-wide paging announcement: authoritative and clear (same wording family as the alerts). Keep ""UPES Emergency Alert Service"" as the recognisable service name - see the guide for how to render the brand + acronym."
"upes-ecs/announce-assemble","paging","upes-ecs/announce-assemble.wav","12","Attention. This is the UPES Emergency Alert Service. Proceed to your designated assembly point now. Move calmly, help others where you can, and wait to be counted. Await further instructions.","Bala xwe bidin. Ev Xizmeta Hişyariya Awarte ya UPES e. Niha biçin cihê civîna xwe yê diyarkirî. Bi aramî bimeşin, li cihê ku hûn dikarin alîkariya kesên din bikin, û li benda jimartinê bin. Li benda talîmatên din bin.","Campus-wide paging announcement: authoritative and clear (same wording family as the alerts). Keep ""UPES Emergency Alert Service"" as the recognisable service name - see the guide for how to render the brand + acronym."
"upes-ecs/callout-notify","paging","upes-ecs/callout-notify.wav","8","Attention. This is a notification from the UPES Emergency Alert Service. Please listen carefully and follow the instructions that follow.","Bala xwe bidin. Ev agahdariyek ji Xizmeta Hişyariya Awarte ya UPES e. Ji kerema xwe bi baldarî guhdarî bikin û talîmatên ku tên bişopînin.","Campus-wide paging announcement: authoritative and clear (same wording family as the alerts). Keep ""UPES Emergency Alert Service"" as the recognisable service name - see the guide for how to render the brand + acronym. Very short prompt: keep spoken length under about 8s."
"upes-ecs/drill-prompt","system","upes-ecs/drill-prompt.wav","11","This is a UPES emergency system drill. This is only a test. No real emergency is in progress, and no response will be dispatched. Thank you.","Ev ceribandineke pergala awarte ya UPES e. Ev tenê testek e. Tu rewşa awarte ya rastîn nîne, û tu bersiv nayê şandin. Spas.","System status prompt: neutral, clear, brief."
"upes-ecs/emergency-voicemail-prompt","system","upes-ecs/emergency-voicemail-prompt.wav","14","No responder is available to take your call right now. After the tone, please say your name, where you are, and what is happening. Stay safe. Help will call you back as soon as possible.","Niha tu bersivder ne vala ye ku bangê we bigire. Piştî dengî, ji kerema xwe navê xwe, cihê ku hûn lê ne, û çi diqewime bibêjin. Ewle bimînin. Alîkarî wê bi qasî ku dibe zû li we vegere.","System status prompt: neutral, clear, brief."
"upes-ecs/not-authorized","system","upes-ecs/not-authorized.wav","4","Sorry. You are not authorised to use this feature.","Bibore. Hûn ne destûrdar in ku vê taybetmendiyê bikar bînin.","System status prompt: neutral, clear, brief. Very short prompt: keep spoken length under about 4s."
"upes-ecs/queue-hold","system","upes-ecs/queue-hold.wav","6","Please stay on the line. We are connecting you to a responder now.","Ji kerema xwe li ser xetê bimînin. Em we niha bi bersivderekê ve girê didin.","System status prompt: neutral, clear, brief. Very short prompt: keep spoken length under about 6s."
