"id","category","file","max_seconds","en","ru","notes"
"upes-ecs/announce-avoid-area","paging","upes-ecs/announce-avoid-area.wav","14","Attention. This is the UPES Emergency Alert Service. There is an incident on campus. Stay away from the affected area, do not approach, and follow the instructions of security staff. Await further instructions.","Внимание. Это Служба экстренного оповещения UPES. На территории кампуса произошло происшествие. Держитесь подальше от затронутой зоны, не приближайтесь и следуйте указаниям сотрудников безопасности. Ждите дальнейших указаний.","Campus-wide paging announcement: authoritative and clear (same wording family as the alerts). Keep ""UPES Emergency Alert Service"" as the recognisable service name - see the guide for how to render the brand + acronym."
"upes-ecs/announce-all-clear","paging","upes-ecs/announce-all-clear.wav","10","Attention. This is the UPES Emergency Alert Service. The emergency is now over. It is safe to resume normal activity. Thank you for your cooperation.","Внимание. Это Служба экстренного оповещения UPES. Чрезвычайная ситуация закончилась. Можно безопасно вернуться к обычной деятельности. Спасибо за сотрудничество.","Campus-wide paging announcement: authoritative and clear (same wording family as the alerts). Keep ""UPES Emergency Alert Service"" as the recognisable service name - see the guide for how to render the brand + acronym."
"upes-ecs/announce-assemble","paging","upes-ecs/announce-assemble.wav","12","Attention. This is the UPES Emergency Alert Service. Proceed to your designated assembly point now. Move calmly, help others where you can, and wait to be counted. Await further instructions.","Внимание. Это Служба экстренного оповещения UPES. Немедленно проследуйте к назначенному месту сбора. Двигайтесь спокойно, помогайте другим, где можете, и ждите переклички. Ждите дальнейших указаний.","Campus-wide paging announcement: authoritative and clear (same wording family as the alerts). Keep ""UPES Emergency Alert Service"" as the recognisable service name - see the guide for how to render the brand + acronym."
"upes-ecs/callout-notify","paging","upes-ecs/callout-notify.wav","8","Attention. This is a notification from the UPES Emergency Alert Service. Please listen carefully and follow the instructions that follow.","Внимание. Это уведомление от Службы экстренного оповещения UPES. Пожалуйста, слушайте внимательно и следуйте указаниям, которые последуют далее.","Campus-wide paging announcement: authoritative and clear (same wording family as the alerts). Keep ""UPES Emergency Alert Service"" as the recognisable service name - see the guide for how to render the brand + acronym. Very short prompt: keep spoken length under about 8s."
"upes-ecs/drill-prompt","system","upes-ecs/drill-prompt.wav","11","This is a UPES emergency system drill. This is only a test. No real emergency is in progress, and no response will be dispatched. Thank you.","Это учения экстренной системы UPES. Это только тест. Никакой реальной чрезвычайной ситуации нет, и никакого реагирования направлено не будет. Спасибо.","System status prompt: neutral, clear, brief."
"upes-ecs/emergency-voicemail-prompt","system","upes-ecs/emergency-voicemail-prompt.wav","14","No responder is available to take your call right now. After the tone, please say your name, where you are, and what is happening. Stay safe. Help will call you back as soon as possible.","Сейчас нет оператора, который мог бы принять ваш звонок. После сигнала, пожалуйста, назовите своё имя, где вы находитесь и что происходит. Будьте в безопасности. Помощь перезвонит вам как можно скорее.","System status prompt: neutral, clear, brief."
"upes-ecs/not-authorized","system","upes-ecs/not-authorized.wav","4","Sorry. You are not authorised to use this feature.","Извините. У вас нет прав на использование этой функции.","System status prompt: neutral, clear, brief. Very short prompt: keep spoken length under about 4s."
"upes-ecs/queue-hold","system","upes-ecs/queue-hold.wav","6","Please stay on the line. We are connecting you to a responder now.","Пожалуйста, оставайтесь на линии. Мы сейчас соединяем вас с оператором.","System status prompt: neutral, clear, brief. Very short prompt: keep spoken length under about 6s."
"upes-ecs/queue-paused","system","upes-ecs/queue-paused.wav","7","You are now paused, and will not receive emergency calls. Dial star four six to resume.","Вы теперь на паузе и не будете получать экстренные звонки. Наберите звёздочка четыре шесть, чтобы возобновить.","System status prompt: neutral, clear, brief. Contains a star / feature code (e.g. *23, *46): keep the digits exactly. Render ""star"" plus the digits the way your users dial them - see the guide. Very short prompt: keep spoken length under about 7s."
"upes-ecs/queue-resumed","system","upes-ecs/queue-resumed.wav","4","You are now available, and will receive emergency calls again.","Вы теперь доступны и снова будете получать экстренные звонки.","System status prompt: neutral, clear, brief. Very short prompt: keep spoken length under about 4s."
"upes-ecs/coach/pick-language","coach","upes-ecs/coach/pick-language.wav","8","To change the language, press 1 for English, or 2 for Hindi.","Чтобы сменить язык, нажмите 1 для английского или 2 для хинди.","Language chooser played on * in the panic-coach. Keys 1 and 2 are physical DTMF - keep the numerals; translate the language names naturally. Draft (AI) - native review pending."
